{
  "schema_version": "1.0",
  "context_id": "77777777-7777-4777-8777-777777777777",
  "tenant_id": "11111111-1111-4111-8111-111111111111",
  "world_id": "test-demo-001",
  "mode": "test",
  "run_id": "33333333-3333-4333-8333-333333333333",
  "call_sequence": 1,
  "goal_version_ref": "nl:GoalVersion/retention-v1",
  "policy_revision": "policy-001",
  "ontology_schema_revision": "schema-001",
  "semantic_snapshot_ref": "nl:SemanticSnapshot/semantic-001",
  "context_strategy_version": "context-v1",
  "model_provider": "deterministic-test",
  "model_id": "fixture-model-v1",
  "embedding_profile_ref": null,
  "sources": [
    {
      "ref": "nl:Message/demo-001",
      "revision": "1",
      "content_hash": "bbbbbbbbbbbbbbbbbbbbbbbbbbbbbbbbbbbbbbbbbbbbbbbbbbbbbbbbbbbbbbbb",
      "evidence_kind": "current_message",
      "access_decision_ref": "eios:AccessDecision/demo-001"
    }
  ],
  "prompt_artifact_ref": "artifact:request-demo-001",
  "request_digest": "cccccccccccccccccccccccccccccccccccccccccccccccccccccccccccccccc",
  "input_token_budget": 16000,
  "output_token_budget": 4000,
  "redaction_policy_ref": "nl:RedactionPolicy/default-v1",
  "created_at": "2026-10-07T08:00:00Z"
}
